{
  "captured_at": "2026-06-23T15:18:34+02:00",
  "checks": {
    "head_recorded": true,
    "runtime_not_applicable_recorded": true
  },
  "limits": [],
  "repo": {
    "branch": "main",
    "head": "e3e555df0c058f4404ee2104c41ceef7e37cee4a",
    "path": "~/Documents/Projects/StateDD_Template",
    "status_porcelain": "M .github/workflows/validate.yml\n M README.md\n M docs/GETTING_STARTED_5_MIN.md\n M docs/UPGRADING.md\n M prompts/EVIDENCE_README_TEMPLATE.md\n M scripts/README.md\n M scripts/check_state_docs.py\n M scripts/init_template.py\n M scripts/statedd_audit.py\n M scripts/statedd_doctor.py\n M scripts/test_init_template.py\n?? fixtures/schema_validation/\n?? schemas/\n?? scripts/statedd_validate_schema.py\n?? scripts/test_schema_validation.py",
    "worktree_clean": false
  },
  "runtime": {
    "reason": "template-maintenance docs/scripts/schema validation slice; no application runtime",
    "required": false
  },
  "schema": "statedd.runtime_identity.v1"
}
