{
  "captured_at": "2026-06-23T16:57:04+02:00",
  "checks": {
    "head_recorded": true,
    "runtime_not_applicable_recorded": true
  },
  "limits": [],
  "repo": {
    "branch": "main",
    "head": "35e8f468123ae3f799d6952d82d026b1bd95ea52",
    "path": "~/Documents/Projects/StateDD_Template",
    "status_porcelain": "M docs/evidence/2026-06-23-release-readiness-polish/README.md",
    "worktree_clean": false
  },
  "runtime": {
    "reason": "docs/scripts-only slice",
    "required": false
  },
  "schema": "statedd.runtime_identity.v1"
}
