{
  "captured_at": "2026-06-23T14:57:50+02:00",
  "checks": {
    "head_recorded": true,
    "runtime_not_applicable_recorded": true
  },
  "limits": [],
  "repo": {
    "branch": "main",
    "head": "7ba2a9e72da3860ebb42ba00c614a5a75228c2b3",
    "path": "~/Documents/Projects/StateDD_Template",
    "status_porcelain": "M .github/workflows/validate.yml\n M BACKLOG.md\n M NEXT_ACTIONS.md\n M PROJECT_DNA.yaml\n M PROJECT_STATE.yaml\n M README.md\n M STATUS.md\n M prompts/EVIDENCE_README_TEMPLATE.md\n M prompts/FINAL_HANDOFF_TEMPLATE.md\n M scripts/README.md\n M scripts/check_state_docs.py\n M scripts/init_template.py\n M scripts/statedd_audit.py\n M scripts/statedd_doctor.py\n M scripts/statedd_runtime_proof.py\n M scripts/test_init_template.py\n?? scripts/test_runtime_proof.py",
    "worktree_clean": false
  },
  "runtime": {
    "reason": "template-maintenance docs/scripts-only slice",
    "required": false
  },
  "schema": "statedd.runtime_identity.v1"
}
