{
  "captured_at": "2026-06-23T17:20:31+02:00",
  "checks": {
    "head_recorded": true,
    "runtime_not_applicable_recorded": true
  },
  "limits": [],
  "repo": {
    "branch": "feature/provider-agnostic-browser-verification",
    "head": "eb0cd886e900c2e35ddb8123b9fd599631335f89",
    "path": "~/Documents/Projects/StateDD_Template/.worktrees/feature-provider-agnostic-browser-verification",
    "status_porcelain": "M .github/workflows/validate.yml\n M prompts/EVIDENCE_README_TEMPLATE.md\n M prompts/FINAL_HANDOFF_TEMPLATE.md\n M scripts/check_state_docs.py\n M scripts/statedd_audit.py\n M scripts/statedd_doctor.py\n M scripts/statedd_validate_schema.py\n?? docs/BROWSER_VERIFICATION.md\n?? fixtures/browser_verification/\n?? schemas/browser_verification.schema.json\n?? scripts/statedd_browser_verify.py\n?? scripts/test_browser_verification.py",
    "worktree_clean": false
  },
  "runtime": {
    "reason": "docs/scripts-only template-maintenance slice introducing provider-agnostic browser verification contract",
    "required": false
  },
  "schema": "statedd.runtime_identity.v1"
}
