{
  "captured_at": "2026-06-28T19:12:43+02:00",
  "checks": {
    "head_recorded": true,
    "runtime_not_applicable_recorded": true
  },
  "limits": [],
  "repo": {
    "branch": "efficiency-layer",
    "head": "aa27fb09f7ae83323d969b83666588b79d54591b",
    "path": "/home/ff/Documents/Projects/StateDD_Template/.worktrees/efficiency-layer",
    "status_porcelain": "M scripts/check_state_docs.py\n M scripts/init_template.py",
    "worktree_clean": false
  },
  "runtime": {
    "reason": "Efficiency layer is docs/scripts-only; no user-facing runtime behavior.",
    "required": false
  },
  "schema": "statedd.runtime_identity.v1"
}
